{
  "schemaVersion": "gateway-line-manifest/v0-draft-1",
  "id": "muyuan-openai-aggregator-api",
  "identity": {
    "serviceProviderKey": "muyuan_platform",
    "serviceProviderLabel": "Muyuan OpenAI-compatible",
    "providerSurfaceKey": "muyuan-openai",
    "providerSurfaceLabel": "Muyuan OpenAI-compatible",
    "protocolProfile": "muyuan",
    "implementationLine": "aggregator_api",
    "adapter": "openai_compatible",
    "sourceKind": "aggregator_api",
    "executionMode": "direct_http",
    "templateFamily": "openai_compatible_official_api_common"
  },
  "capabilities": {
    "families": ["conversation", "models"],
    "supportsModelsEndpoint": false
  },
  "credentials": {
    "materialKinds": ["api_key"],
    "samplePath": "docs/20-ai-gateway/examples/credentials/muyuan/aggregator_api/minimal.raw.sample.json",
    "fieldsDocPath": "docs/20-ai-gateway/examples/credentials/muyuan/aggregator_api/FIELDS.md"
  },
  "docs": {
    "overviewDocPath": "docs/20-ai-gateway/Muyuan聚合API实现线基线.md",
    "buildDocPath": "docs/20-ai-gateway/examples/credentials/muyuan/aggregator_api/BUILD.md"
  },
  "verification": {
    "recommendedCargoTargetDirSlug": "muyuan-openai-aggregator-api-verify",
    "focusedCargoFilters": [
      "implementation_lines::tests::payloads::payload_inference_distinguishes_wave4_openai_compatible_base_urls"
    ],
    "fixtureSuiteId": "muyuan_fixture",
    "liveSuiteId": "muyuan_live",
    "useNoDefaultFeatures": true
  },
  "compilation": {
    "compileLayer": "line_compile_gate",
    "lineFeature": "line-muyuan-openai-aggregator-api",
    "familyCommonFeatures": ["family-openai-compatible-official-api"],
    "binaryInclusionGroup": "muyuan-openai-aggregator-api"
  },
  "implementation": {
    "protocolModule": "gateway/src/protocol/registry.rs",
    "upstreamModule": "gateway/src/upstream/openai_compatible_official_api_common.rs",
    "platformDeltaModule": "gateway/src/implementation_lines.rs"
  }
}
