{
  "schemaVersion": "gateway-line-manifest/v0-draft-1",
  "id": "gemini-web-reverse",
  "identity": {
    "serviceProviderKey": "gemini_platform",
    "serviceProviderLabel": "Gemini Platform",
    "providerSurfaceKey": "gemini-web-chat",
    "providerSurfaceLabel": "Gemini Web Reverse",
    "protocolProfile": "gemini_web_reverse_modular",
    "implementationLine": "web_reverse",
    "adapter": "gemini_web_reverse_modular_compatible",
    "sourceKind": "web_reverse_api",
    "executionMode": "browser_backed"
  },
  "capabilities": {
    "families": ["conversation", "images", "audio_speech", "models"],
    "supportsModelsEndpoint": true
  },
  "credentials": {
    "materialKinds": ["session_auth", "browser_state"],
    "samplePath": "docs/20-ai-gateway/examples/credentials/gemini/web_reverse/minimal.raw.sample.json",
    "fieldsDocPath": "docs/20-ai-gateway/examples/credentials/gemini/web_reverse/FIELDS.md"
  },
  "docs": {
    "overviewDocPath": "docs/20-ai-gateway/Gemini三线路与Canvas派生运行时架构规范.md",
    "buildDocPath": "docs/20-ai-gateway/服务商实现线与Provider目录.md"
  },
  "verification": {
    "recommendedCargoTargetDirSlug": "gemini-web-reverse-verify",
    "focusedCargoFilters": [
      "protocol::gemini::web_reverse",
      "upstream::gemini::web_reverse"
    ],
    "fixtureSuiteId": "gemini_web_reverse_modular_fixture",
    "liveSuiteId": "gemini_web_reverse_modular_legacy_media_live",
    "useNoDefaultFeatures": true
  },
  "compilation": {
    "compileLayer": "binary_exclusion",
    "lineFeature": "line-gemini-web-reverse",
    "binaryInclusionGroup": "gemini-web-reverse"
  },
  "implementation": {
    "protocolModule": "gateway/src/protocol/gemini/web_reverse",
    "upstreamModule": "gateway/src/upstream/gemini/web_reverse",
    "platformDeltaModule": "gateway/src/protocol/gemini/web_reverse"
  }
}
