{
  "schemaVersion": "gateway-line-manifest/v0-draft-1",
  "id": "linkup-search-official-vendor-api",
  "identity": {
    "serviceProviderKey": "linkup_platform",
    "serviceProviderLabel": "Linkup Search",
    "providerSurfaceKey": "linkup-search",
    "providerSurfaceLabel": "Linkup Search",
    "protocolProfile": "linkup",
    "implementationLine": "official_vendor_api",
    "adapter": "search_api_compatible",
    "sourceKind": "official_vendor_api",
    "executionMode": "direct_http",
    "templateFamily": "search_api_common"
  },
  "capabilities": {
    "families": [
      "search",
      "fetch",
      "research",
      "credits_balance"
    ]
  },
  "credentials": {
    "materialKinds": [
      "api_key"
    ],
    "samplePath": "docs/20-ai-gateway/examples/credentials/linkup/official_vendor_api/minimal.raw.sample.json",
    "fieldsDocPath": "docs/20-ai-gateway/examples/credentials/linkup/official_vendor_api/FIELDS.md"
  },
  "docs": {
    "overviewDocPath": "docs/20-ai-gateway/Linkup Search平台实现线、可选编译与物理隔离基线.md",
    "buildDocPath": "docs/20-ai-gateway/examples/credentials/linkup/official_vendor_api/BUILD.md"
  },
  "verification": {
    "recommendedCargoTargetDirSlug": "linkup-search-official-vendor-api-verify",
    "focusedCargoFilters": [
      "preset::tests::linkup_preset_has_search_adapter_and_path",
      "implementation_lines::tests::linkup_search_protocol_profiles_compile_when_feature_enabled",
      "provider_credential_folder_sync::tests::derive_provider_surface_slug_maps_search_family_lines"
    ],
    "fixtureSuiteId": "linkup_fixture",
    "useNoDefaultFeatures": true
  },
  "compilation": {
    "compileLayer": "line_compile_gate",
    "lineFeature": "line-linkup-search-official-vendor-api",
    "familyCommonFeatures": [
      "family-search-api-compatible-official-api"
    ],
    "binaryInclusionGroup": "linkup-search-official-vendor-api"
  },
  "implementation": {
    "protocolModule": "gateway/src/protocol/search_api.rs",
    "upstreamModule": "gateway/src/upstream/search_provider_helpers.rs",
    "platformDeltaModule": "gateway/src/implementation_lines.rs"
  }
}
