{
  "schemaVersion": "gateway-line-manifest/v0-draft-1",
  "id": "mistral-openai-official-model-api",
  "identity": {
    "serviceProviderKey": "mistral_platform",
    "serviceProviderLabel": "Mistral OpenAI-compatible",
    "providerSurfaceKey": "mistral-openai",
    "providerSurfaceLabel": "Mistral OpenAI-compatible",
    "protocolProfile": "mistral",
    "implementationLine": "official_model_api",
    "adapter": "openai_compatible",
    "sourceKind": "official_model_api",
    "executionMode": "direct_http",
    "templateFamily": "openai_compatible_official_api_common"
  },
  "capabilities": {
    "families": ["conversation", "models"],
    "supportsModelsEndpoint": true
  },
  "credentials": {
    "materialKinds": ["api_key"],
    "samplePath": "docs/20-ai-gateway/examples/credentials/mistral/official_model_api/minimal.raw.sample.json",
    "fieldsDocPath": "docs/20-ai-gateway/examples/credentials/mistral/official_model_api/FIELDS.md"
  },
  "docs": {
    "overviewDocPath": "docs/20-ai-gateway/Mistral平台实现线、可选编译与物理隔离基线.md",
    "buildDocPath": "docs/20-ai-gateway/examples/credentials/mistral/official_model_api/BUILD.md"
  },
  "verification": {
    "recommendedCargoTargetDirSlug": "mistral-openai-official-model-api-verify",
    "focusedCargoFilters": [
      "implementation_lines::tests::payloads::payload_inference_distinguishes_wave4_openai_compatible_base_urls",
      "protocol::hooks::tests::resolve_returns_mistral_hook_for_mistral_provider",
      "provider_credential_folder_sync::tests::catalog_text::derive_provider_surface_slug_maps_wave4_openai_compatible_lines"
    ],
    "fixtureSuiteId": "mistral_fixture",
    "liveSuiteId": "mistral_live",
    "useNoDefaultFeatures": true
  },
  "compilation": {
    "compileLayer": "line_compile_gate",
    "lineFeature": "line-mistral-openai-official-model-api",
    "familyCommonFeatures": ["family-openai-compatible-official-api"],
    "binaryInclusionGroup": "mistral-openai-official-model-api"
  },
  "implementation": {
    "protocolModule": "gateway/src/protocol/hooks.rs",
    "upstreamModule": "gateway/src/upstream/openai_compatible_official_api_common.rs",
    "platformDeltaModule": "gateway/src/protocol/hooks.rs"
  }
}
